{
  "$schema": "soft-vectors-v1.schema.json",
  "profile": "flop-soft-v1",
  "status": "illustrative-non-consensus",
  "version": "1.0.0",
  "source": {
    "title": "FLOP Network Yellow Paper",
    "version": "0.5.0",
    "url": "https://github.com/flop-labs/yellowpaper/blob/main/yellowpaper.md",
    "note": "The public repository labels v0.5.0 as an initial draft; this profile is a small proposal for the open E.33 SOFT-tier item."
  },
  "requirements": [
    {"id": "R3.1", "citation": "§3.1", "text": "Settled sessions carry a required execution-integrity commitment."},
    {"id": "R3.3", "citation": "§3.1", "text": "Independent re-execution and collectible aggregate exposure must satisfy the effective-challenge deterrence condition."},
    {"id": "R3.5", "citation": "§3.1", "text": "Accepted evidence binds task, metered work, model, and output."},
    {"id": "R3.6", "citation": "§3.1", "text": "Each task is creditable at most once."},
    {"id": "R5.3d", "citation": "§5.3", "text": "Ephemeral evidence retention covers the challenge window."},
    {"id": "R12.1b", "citation": "§12.1", "text": "SOFT turns use a session key and co-signed monotonic receipts."},
    {"id": "R12.1a", "citation": "§12.1", "text": "Reserved escrow is paid optimistically; timeout and fraud are refund paths."},
    {"id": "R12.1d", "citation": "§12.1", "text": "Failed or early close uses an explicit refund and tariff split."},
    {"id": "R12.1f", "citation": "§12.1", "text": "Fraud disputes and response timeouts refund the agent and slash the miner."},
    {"id": "R13.0b", "citation": "§13.0", "text": "Temporary DA loss may extend a window once without payout or slash."},
    {"id": "R13.0c", "citation": "§13.0", "text": "Unrecoverable DA fails closed with escrow and challenger-bond refund."},
    {"id": "E.33", "citation": "Appendix E", "text": "The non-TEE SOFT tier needs an end-to-end profile."},
    {"id": "E.45", "citation": "Appendix E", "text": "The effective-challenge incentive model is conditional and illustrative."}
  ],
  "harnessed_bound_fields": ["session_id", "profile", "index", "task_hash", "model_hash", "payload_hash", "decode_policy_hash", "precision", "backend", "gpu_cell", "prompt_hash", "input_hash", "output_hash", "gn", "toploc_root", "activation_commitment", "da_reference", "nonce"],
  "vectors": [
    {
      "id": "commitment-binding-accept",
      "requirement_ids": ["R3.1", "R3.5", "R12.1b"],
      "source_citations": ["FLOP Yellow Paper v0.5.0 §3.1 R3.5", "FLOP Yellow Paper v0.5.0 §12.1 R12.1b"],
      "description": "A co-signed turn with the session commitment can settle.",
      "trace": [
        {"op": "fund_miner", "miner": "miner-a", "amount": 120},
        {"op": "open", "session_id": "s-accept", "agent": "agent-a", "miner": "miner-a", "task_hash": "task-accept", "model_hash": "model-1", "payload_hash": "payload-1", "decode_policy_hash": "decode-1", "precision": "fp16", "backend": "backend-1", "gpu_cell": "gpu-cell-1", "prompt_hash": "prompt-1", "input_hash": "input-1", "toploc_root": "toploc-1", "da_reference": "da-1", "commitment": "commit-1", "escrow": 50, "reserved_collateral": 120, "declared_exposure": 50, "p_effective_lower_bound": 0.5, "block": 1},
        {"op": "turn", "session_id": "s-accept", "index": 0, "task_hash": "task-accept", "model_hash": "model-1", "precision": "fp16", "backend": "backend-1", "gpu_cell": "gpu-cell-1", "prompt_hash": "prompt-1", "input_hash": "input-1", "toploc_root": "toploc-1", "activation_commitment": "commit-1", "da_reference": "da-1", "output_hash": "out-1", "commitment": {"derive": "turn"}, "gn": 12},
        {"op": "settle", "session_id": "s-accept", "block": 2, "aggregate_gn": 12, "toploc_root": "toploc-1", "activation_commitment": "commit-1", "da_reference": "da-1"}
      ],
      "expected": {"accepted": true, "code": "SETTLED", "status": "settled", "credited_gn": 12}
    },
    {
      "id": "commitment-binding-reject",
      "requirement_ids": ["R3.1", "R3.5"],
      "source_citations": ["FLOP Yellow Paper v0.5.0 §3.1 R3.5"],
      "description": "A turn with a different derived commitment is rejected before settlement.",
      "trace": [
        {"op": "fund_miner", "miner": "miner-a", "amount": 120},
        {"op": "open", "session_id": "s-bind", "agent": "agent-a", "miner": "miner-a", "task_hash": "task-bind", "model_hash": "model-1", "payload_hash": "payload-1", "decode_policy_hash": "decode-1", "precision": "fp16", "backend": "backend-1", "gpu_cell": "gpu-cell-1", "prompt_hash": "prompt-1", "input_hash": "input-1", "toploc_root": "toploc-1", "da_reference": "da-1", "commitment": "commit-1", "escrow": 50, "reserved_collateral": 120, "declared_exposure": 50, "p_effective_lower_bound": 0.5},
        {"op": "turn", "session_id": "s-bind", "index": 0, "task_hash": "task-bind", "model_hash": "model-1", "precision": "fp16", "backend": "backend-1", "gpu_cell": "gpu-cell-1", "prompt_hash": "prompt-1", "input_hash": "input-1", "toploc_root": "toploc-1", "activation_commitment": "commit-1", "da_reference": "da-1", "output_hash": "out-1", "commitment": "commit-other", "gn": 12}
      ],
      "expected": {"accepted": false, "code": "DERIVED_COMMITMENT_MISMATCH", "status": "open"}
    },
    {
      "id": "duplicate-credit-reject",
      "requirement_ids": ["R3.6"],
      "source_citations": ["FLOP Yellow Paper v0.5.0 §3.1 R3.6"],
      "description": "A second session using an already credited task is rejected.",
      "trace": [
        {"op": "fund_miner", "miner": "miner-a", "amount": 120},
        {"op": "open", "session_id": "s-first", "agent": "agent-a", "miner": "miner-a", "task_hash": "task-dupe", "model_hash": "model-1", "payload_hash": "payload-1", "decode_policy_hash": "decode-1", "precision": "fp16", "backend": "backend-1", "gpu_cell": "gpu-cell-1", "prompt_hash": "prompt-1", "input_hash": "input-1", "toploc_root": "toploc-1", "da_reference": "da-1", "commitment": "commit-1", "escrow": 50, "reserved_collateral": 120, "declared_exposure": 50, "p_effective_lower_bound": 0.5},
        {"op": "turn", "session_id": "s-first", "index": 0, "task_hash": "task-dupe", "model_hash": "model-1", "precision": "fp16", "backend": "backend-1", "gpu_cell": "gpu-cell-1", "prompt_hash": "prompt-1", "input_hash": "input-1", "toploc_root": "toploc-1", "activation_commitment": "commit-1", "da_reference": "da-1", "output_hash": "out-1", "commitment": {"derive": "turn"}, "gn": 1},
        {"op": "settle", "session_id": "s-first", "block": 2, "aggregate_gn": 1, "toploc_root": "toploc-1", "activation_commitment": "commit-1", "da_reference": "da-1"},
        {"op": "open", "session_id": "s-second", "agent": "agent-a", "miner": "miner-a", "task_hash": "task-dupe", "model_hash": "model-1", "payload_hash": "payload-1", "decode_policy_hash": "decode-1", "precision": "fp16", "backend": "backend-1", "gpu_cell": "gpu-cell-1", "prompt_hash": "prompt-1", "input_hash": "input-1", "toploc_root": "toploc-1", "da_reference": "da-1", "commitment": "commit-1", "escrow": 50, "reserved_collateral": 0, "declared_exposure": 0, "p_effective_lower_bound": 0.5}
      ],
      "expected": {"accepted": false, "code": "DUPLICATE_CREDIT", "status": "absent"}
    },
    {
      "id": "challenge-window-accept",
      "requirement_ids": ["R5.3d", "R12.1f"],
      "source_citations": ["FLOP Yellow Paper v0.5.0 §12.1 R12.1f"],
      "description": "A standing validator can challenge at the inclusive window boundary.",
      "trace": [
        {"op": "fund_miner", "miner": "miner-a", "amount": 120},
        {"op": "open", "session_id": "s-window", "agent": "agent-a", "miner": "miner-a", "task_hash": "task-window", "model_hash": "model-1", "payload_hash": "payload-1", "decode_policy_hash": "decode-1", "precision": "fp16", "backend": "backend-1", "gpu_cell": "gpu-cell-1", "prompt_hash": "prompt-1", "input_hash": "input-1", "toploc_root": "toploc-1", "da_reference": "da-1", "commitment": "commit-1", "escrow": 50, "reserved_collateral": 120, "declared_exposure": 50, "p_effective_lower_bound": 0.5, "block": 1},
        {"op": "turn", "session_id": "s-window", "index": 0, "task_hash": "task-window", "model_hash": "model-1", "precision": "fp16", "backend": "backend-1", "gpu_cell": "gpu-cell-1", "prompt_hash": "prompt-1", "input_hash": "input-1", "toploc_root": "toploc-1", "activation_commitment": "commit-1", "da_reference": "da-1", "output_hash": "out-1", "commitment": {"derive": "turn"}, "gn": 1},
        {"op": "settle", "session_id": "s-window", "block": 2, "aggregate_gn": 1, "toploc_root": "toploc-1", "activation_commitment": "commit-1", "da_reference": "da-1"},
        {"op": "fund_challenger", "challenger": "validator:v1", "amount": 100},
        {"op": "challenge", "session_id": "s-window", "challenger": "validator:v1", "block": 102, "bond": 100}
      ],
      "expected": {"accepted": true, "code": "CHALLENGE_OPENED", "status": "challenged"}
    },
    {
      "id": "challenge-window-reject",
      "requirement_ids": ["R12.1f"],
      "source_citations": ["FLOP Yellow Paper v0.5.0 §12.1 R12.1f"],
      "description": "A challenge after the window is rejected.",
      "trace": [
        {"op": "fund_miner", "miner": "miner-a", "amount": 120},
        {"op": "open", "session_id": "s-late", "agent": "agent-a", "miner": "miner-a", "task_hash": "task-late", "model_hash": "model-1", "payload_hash": "payload-1", "decode_policy_hash": "decode-1", "precision": "fp16", "backend": "backend-1", "gpu_cell": "gpu-cell-1", "prompt_hash": "prompt-1", "input_hash": "input-1", "toploc_root": "toploc-1", "da_reference": "da-1", "commitment": "commit-1", "escrow": 50, "reserved_collateral": 120, "declared_exposure": 50, "p_effective_lower_bound": 0.5},